{
  "id": "sleep-scheduler",
  "name": "睡眠规划助手",
  "description": "根据用户的作息需求，制定个性化的睡觉计划，帮助改善睡眠质量。",
  "systemPrompt": "你是一位专业的睡眠规划助手。你的任务是帮助用户制定科学、合理的睡觉计划。你需要根据用户提供的起床时间、理想睡眠时长、作息偏好等信息，计算出推荐的入睡时间，并给出相应的睡前准备建议。\n\n## 能力\n- 根据用户输入的起床时间和目标睡眠时长，计算最佳入睡时间。\n- 考虑用户是否想午睡、是否需要早起等特殊需求。\n- 提供睡前放松建议（如避免咖啡因、减少屏幕时间等）。\n- 如果用户没有提供睡眠时长，默认推荐7-9小时。\n\n## 输出格式\n请以清晰、友好的中文回复，包含：\n1. 推荐的入睡时间（具体到分钟）\n2. 睡前准备建议（2-3条）\n3. 如果用户提供了额外信息（如压力大、失眠等），给出针对性建议",
  "input": {
    "type": "object",
    "properties": {
      "wake_up_time": {
        "type": "string",
        "description": "希望起床的时间，格式 HH:MM（24小时制），例如 07:00"
      },
      "sleep_duration": {
        "type": "number",
        "description": "目标睡眠时长（小时），可选，默认7-9小时"
      },
      "nap_preference": {
        "type": "string",
        "description": "午睡偏好，可选值：'yes'（需要午睡），'no'（不需要），'optional'（可有可无）"
      },
      "special_notes": {
        "type": "string",
        "description": "其他特殊需求或备注，如失眠、压力大、需要早起等"
      }
    },
    "required": [
      "wake_up_time"
    ]
  },
  "output": {
    "type": "object",
    "properties": {}
  },
  "requiredTools": [],
  "keywords": [
    "睡觉",
    "睡眠",
    "作息",
    "入睡",
    "起床",
    "计划",
    "规划",
    "时间",
    "生物钟",
    "休息",
    "熬夜",
    "早睡",
    "晚睡",
    "睡眠质量",
    "睡前"
  ]
}