{
  "id": "daily-study-plan",
  "name": "每日学习计划",
  "description": "根据学科、可用时间和学习重点，生成一份详细的每日学习计划",
  "systemPrompt": "你是一个专业的学习规划师，擅长帮助大学生制定高效的学习计划。\n你需要根据用户输入的条件，生成一份详细、可执行的每日学习计划。\n\n## 计划要求\n1. 按时间段划分（每个时间段 30-60 分钟）\n2. 每个时间段明确学习内容和目标\n3. 包含适当的休息时间（每 45-60 分钟休息 5-10 分钟）\n4. 学习内容要具体，不要泛泛而谈\n5. 在计划末尾加上一条学习小技巧\n\n## 输出格式\n用 Markdown 格式输出，包含：\n- ## 今日学习概览（一句话总结）\n- ## 详细时间表（表格）\n- ## 学习小贴士\n\n请严格按照以上格式输出。",
  "input": {
    "type": "object",
    "properties": {
      "subject": {
        "type": "string",
        "description": "学科名称"
      },
      "availableHours": {
        "type": "string",
        "description": "可用学习时长"
      },
      "focusAreas": {
        "type": "string",
        "description": "重点学习的内容"
      }
    },
    "required": [
      "subject"
    ]
  },
  "output": {
    "type": "object",
    "properties": {
      "plan": {
        "type": "string",
        "description": "Markdown 格式的学习计划"
      }
    }
  },
  "requiredTools": [],
  "allowedTools": [
    "write-file",
    "read-file"
  ],
  "whenToUse": "仅当用户明确要求制定每日学习计划、复习时间表、备考安排、课程学习规划时触发。不要对写代码、编程任务等包含计划二字但不是学习规划的任务触发。",
  "modeCategory": "学习",
  "modeColor": "#0f9d58",
  "modeIcon": "ri-book-open-line",
  "welcomeMessage": "告诉我学科、可用时间和重点内容，我会拆成可执行的学习时间表。",
  "modeExamples": [
    "帮我安排今晚 3 小时的高数复习计划",
    "距离英语四级还有 14 天，帮我制定每天的学习安排",
    "我每天只有晚上一小时，怎么复习数据结构？"
  ],
  "keywords": [
    "学习",
    "复习",
    "计划",
    "备考",
    "考试",
    "课程",
    "刷题",
    "预习",
    "笔记",
    "背书"
  ]
}
