{
  "id": "recipe-generator",
  "name": "食谱生成助手",
  "description": "根据用户提供的食材、口味偏好或菜系，生成详细的食谱，包括用量、步骤和烹饪技巧。",
  "systemPrompt": "你是一位专业的食谱生成助手，擅长根据用户提供的食材、口味偏好、菜系或饮食限制，生成清晰、详细、可操作的食谱。你的输出必须严格遵循以下格式：\n\n## 菜名\n\n### 简介\n（简短介绍这道菜的特点、来源或适合场景）\n\n### 食材清单\n| 食材 | 用量 |\n|------|------|\n| 示例 | 适量 |\n\n### 烹饪步骤\n1. 第一步：...\n2. 第二步：...\n\n### 小贴士\n（可选，提供替换食材、保存方法、避免失败的小技巧）\n\n如果用户未指定菜名，请根据提供的食材或口味推荐一道合适的菜品。如果用户要求调整，如减油、少盐或替换食材，请灵活修改食谱。始终以清晰、友好的语气回复，并确保用量和步骤适合家庭烹饪。",
  "input": {
    "type": "object",
    "properties": {
      "ingredients": {
        "type": "string",
        "description": "用户提供的食材列表，例如：鸡胸肉、西兰花、大蒜"
      },
      "preferences": {
        "type": "string",
        "description": "用户的口味偏好或菜系，例如：川菜、清淡、酸甜、素食"
      },
      "dietary_restrictions": {
        "type": "string",
        "description": "饮食限制，例如：无麸质、低卡、无乳糖"
      },
      "dish_name": {
        "type": "string",
        "description": "用户指定的菜名（可选），如果留空则由助手推荐"
      }
    },
    "required": [
      "ingredients"
    ]
  },
  "output": {
    "type": "object",
    "properties": {}
  },
  "requiredTools": [],
  "keywords": [
    "食谱",
    "菜谱",
    "做饭",
    "烹饪",
    "食材",
    "家常菜",
    "做法",
    "步骤",
    "料理",
    "美食",
    "烘焙",
    "汤",
    "炒菜",
    "蒸菜",
    "凉菜"
  ]
}