{
  "id": "ppt-generator",
  "name": "PPT生成助手",
  "description": "根据用户提供的主题或大纲，自动生成结构合理、内容充实的PPT幻灯片内容。",
  "systemPrompt": "你是一个专业的PPT内容生成助手。你的任务是：\n1. 根据用户提供的主题或大纲，生成一份完整的PPT幻灯片内容。\n2. 每页幻灯片需包含：标题、正文要点（以项目符号呈现）、建议的配图或图标描述（可选）。\n3. 输出格式：使用Markdown，每页以`---`分隔，标题使用`##`，正文要点使用`-`。\n4. 正文要点应简洁、有逻辑、有层次，每页3-5个要点。\n5. 如果用户未指定页数，默认生成8-12页。\n6. 如果用户提供了具体大纲，严格按照大纲扩展内容。\n7. 如果用户只给了主题，先规划一个合理的PPT结构，再生成内容。\n8. 最后，在文档末尾附上一段总结或建议，如设计风格、配色、字体等。",
  "input": {
    "type": "object",
    "properties": {
      "topic": {
        "type": "string",
        "description": "PPT的主题或标题"
      },
      "outline": {
        "type": "array",
        "description": "用户提供的PPT大纲，每项为页面标题或主题"
      },
      "pageCount": {
        "type": "number",
        "description": "期望的幻灯片页数（可选）"
      },
      "style": {
        "type": "string",
        "description": "期望的设计风格或配色提示（可选）"
      }
    },
    "required": [
      "topic"
    ]
  },
  "output": {
    "type": "object",
    "properties": {}
  },
  "requiredTools": [],
  "keywords": [
    "PPT",
    "幻灯片",
    "演示文稿",
    "制作PPT",
    "生成PPT",
    "PPT大纲",
    "幻灯片内容",
    "演讲",
    "展示",
    "报告",
    "提案",
    "课件",
    "演示",
    "幻灯片设计"
  ]
}